{
  "$ref": "#/definitions/projects",
  "definitions": {
    "projects": {
      "type": "object",
      "properties": {
        "name": {
          "type": "string"
        },
        "description": {
          "type": "string"
        },
        "link": {
          "anyOf": [
            {
              "type": "string",
              "format": "uri"
            },
            {
              "type": "null"
            }
          ]
        },
        "images": {
          "type": "array",
          "items": {
            "type": "object",
            "properties": {
              "src": {
                "type": "string"
              },
              "alt": {
                "type": "string"
              }
            },
            "required": [
              "src",
              "alt"
            ],
            "additionalProperties": false
          },
          "default": []
        },
        "sourceCode": {
          "type": "array",
          "items": {
            "type": "object",
            "properties": {
              "link": {
                "type": "string",
                "format": "uri"
              },
              "host": {
                "type": "string"
              }
            },
            "required": [
              "link",
              "host"
            ],
            "additionalProperties": false
          }
        },
        "tags": {
          "type": "array",
          "items": {
            "type": "string"
          },
          "default": []
        },
        "ranking": {
          "type": "string"
        },
        "$schema": {
          "type": "string"
        }
      },
      "required": [
        "name",
        "description",
        "link",
        "sourceCode",
        "ranking"
      ],
      "additionalProperties": false
    }
  },
  "$schema": "http://json-schema.org/draft-07/schema#"
}