{
  "name": "Converse",
  "description": "Converse is a real-time web chat app utilizing WebRTC and Socket.io. It boasts features such as public chatrooms, live video and audio streaming, the ability to change input/output media devices, and invitation link sharing. I initiated this project with the primary goal of enhancing my knowledge in real-time web communications and protocols.",
  "link": "https://converse.billyle.dev",
  "images": [
    {
      "src": "./_images/converse-lobby-01.webp",
      "alt": "converse user 1 lobby"
    },
    {
      "src": "./_images/converse-lobby-02.webp",
      "alt": "converse user 2 lobby"
    },
    {
      "src": "./_images/converse-chatroom.webp",
      "alt": "converse chatroom"
    },
    {
      "src": "./_images/converse-livestream.webp",
      "alt": "converse livestream"
    }
  ],
  "sourceCode": [
    { "link": "https://github.com/billy-le/converse", "host": "github" }
  ],
  "tags": ["node", "express", "liquidjs", "web-rtc", "socket.io"],
  "ranking": "low"
}
