{
  "name": "Soil Life",
  "description": "I developed an informational website aimed at educating the public about soil life, employing the JAMStack architecture. Initially, the project began as a monolithic stack with static pages served from an Express Node server using Embedded JavaScript Templates (ejs). Eventually, the final product transitioned to React, leveraging Google Sheets as the CMS.",
  "link": "https://soillife.org",
  "images": [
    {
      "src": "./_images/soillife-home.webp",
      "alt": "soil life home page"
    },
    {
      "src": "./_images/soillife-web-of-soil.webp",
      "alt": "soil life - web of soil"
    },
    {
      "src": "./_images/soillife-web-graph.webp",
      "alt": "soil life - web graph"
    },
    {
      "src": "./_images/soillife-media.webp",
      "alt": "soil life - media page"
    },
    {
      "src": "./_images/soillife-101.webp",
      "alt": "soil life - soil 101 page"
    }
  ],
  "sourceCode": [
    { "link": "https://github.com/SoilLife/soil-life-web", "host": "github" }
  ],
  "tags": ["react", "nextjs", "netlify", "tailwind"],
  "ranking": "mid"
}
