{
  "name": "Dotted",
  "description": "An AI-powered mobile application built using Flutter, Supabase, and Node. The app generates an itinerary for users based on their profiles. The AI takes into account their recreational activities, diet, favorite cuisines, and food allergies to create a personalized schedule. Users can then view the itinerary, which displays each location and route on Google Maps.",
  "link": "https://billyle.dev/posts/case-study-building-dotted",
  "images": [
    {
      "src": "./_images/dotted-desktop.webp",
      "alt": "dotted landing page"
    },
    {
      "src": "./_images/dotted-screens.webp",
      "alt": "dotted various screens"
    },
    {
      "src": "./_images/excalidraw_dotted.webp",
      "alt": "dotted app design and logic flow"
    },
    {
      "src": "./_images/dotted-login.gif",
      "alt": "dotted login flow"
    },
    {
      "src": "./_images/dotted-on-boarding.gif",
      "alt": "dotted onboarding flow"
    },
    {
      "src": "./_images/dotted-generate-itinerary.gif",
      "alt": "dotted generating itineraries"
    },
    {
      "src": "./_images/dotted-view-itinerary.gif",
      "alt": "dotted view trip itinerary"
    }
  ],
  "sourceCode": [
    { "link": "https://github.com/dotted-earth", "host": "github" }
  ],
  "tags": ["flutter", "dart", "ai", "supabase", "node", "python"],
  "ranking": "low"
}
